{
  "workload_id": "service-telemetry-hub",
  "workload_class": "core-api",
  "entry_impact": false,
  "public_api_contract_impact": false,
  "read_model_impact": true,
  "async_event_impact": true,
  "runtime_config_gate": false,
  "depends_on_workloads": [
    "service-terminal-registry"
  ],
  "expands_to_workloads": [
    "service-telemetry-listener",
    "service-telemetry-dead-letter",
    "service-vehicle-operations-view"
  ]
}
