{
  "workload_id": "service-attendance-registry",
  "workload_class": "core-api",
  "entry_impact": false,
  "public_api_contract_impact": true,
  "read_model_impact": false,
  "async_event_impact": true,
  "runtime_config_gate": false,
  "depends_on_workloads": [],
  "expands_to_workloads": [
    "service-dispatch-registry",
    "service-delivery-record",
    "service-settlement-payroll"
  ]
}
