{
  "workload_id": "service-organization-registry",
  "workload_class": "core-api",
  "entry_impact": true,
  "public_api_contract_impact": true,
  "read_model_impact": false,
  "async_event_impact": false,
  "runtime_config_gate": false,
  "depends_on_workloads": [],
  "expands_to_workloads": ["front-web-console", "edge-api-gateway", "service-account-access"]
}
